<?xml version="1.0" encoding="UTF-8"?>
<CslaProject xmlns:xsi="http://www.w3.org/2001/XMLSchema-instance" xsi:noNamespaceSchemaLocation="CslaProject.xsd">
	<ProjectName>MyApp.Library</ProjectName>
	<GenerationMethod>SplitPartial</GenerationMethod>
	<Objects>	
		<Object Access="internal" Type="EditableRoot" Name="Project" Namespace="MyApp.Library.Internal" DalNamespace="MyApp.Data">
			<PropertyAuthorization>Write</PropertyAuthorization>
			<TransactionalType>TransactionScope</TransactionalType>
			<AuthorizationRules>false</AuthorizationRules>
			<Properties>
				<Property Name="Id" Type="Guid" DbColumnName="Id" IsPrimaryKey="true"/>
				<Property Name="Name" Type="string" DbColumnName="Name">
					<ValidationRules>
						<StringRequired/>
						<StringMaxLength>50</StringMaxLength>
						<RegExMatch>Email</RegExMatch>
					</ValidationRules>
				</Property>
				<Property Name="Started" Type="SmartDate" NativeType="DateTime?"  DbColumnName="Started">
					<ValidationRules>
						<GenericsMinValue>1/1/2005</GenericsMinValue>
						<RegExMatch>(0[1-9]|1[012])[- /.](0[1-9]|[12][0-9]|3[01])[- /.](19|20)\d\d</RegExMatch>
					</ValidationRules>
				</Property>
				<Property Name="Ended" Type="SmartDate" NativeType="DateTime?" DbColumnName="Ended" Default="new SmartDate(false)"/>
				<Property Name="Description" Type="string" DbColumnName="Description"/>
				<Property Name="Resources" Type="ProjectResources" EntitySetName="Assignments" Default="ProjectResources.NewProjectResources()" IsChildCollection="true"/>
				<Property Name="LastChanged" Type="Timestamp" DbColumnName="LastChanged"/>
			</Properties>
			<DbCommands DbName="PTracker">
				<FetchCommand Type="StoredProcedure">Project_Get</FetchCommand>
				<InsertCommand>Project_Insert</InsertCommand>
				<UpdateCommand>Project_Update</UpdateCommand>
				<DeleteCommand>Project_Delete</DeleteCommand>
			</DbCommands>
		</Object>
		<Object Name="ProjectResources" Type="EditableChildList">
			<Properties>
				<Property Name="ResourceId" Type="int" IsPrimaryKey="true" IsIdentity="true"/>
			</Properties>
			<Relationship Child="Resource" Parent="Project"/>
		</Object>
		<Object Name="Resource" Type="EditableChild" Base="MyFramework.ChildBusinessBase">
			<Properties>
				<Property Name="ResourceId" Type="int" DbColumnName="ResourceId" IsPrimaryKey="true" IsIdentity="true"/>
				<Property Name="FirstName" Type="string" DbColumnName="FirstName" IsReadOnly="true"/>
				<Property Name="LastName" Type="string" DbColumnName="LastName" IsReadOnly="true"/>
				<Property Name="Role" Type="int" DbColumnName="Role"/>
			</Properties>
			<Relationship Parent="Project"/>
		</Object>
	</Objects>
</CslaProject>
